{
  "schema_version": 1,
  "message_id": "3d4e5f60-7182-4d9e-8f0a-1b2c3d4e5f60",
  "message_type": "project.owner_status_changed.v1",
  "occurred_at": "2026-10-24T09:30:00Z",
  "correlation_id": "owner-status:3",
  "project_id": "5f0c2a8e-7c1b-4d2e-9a3f-1b2c3d4e5f60",
  "status": "suspended",
  "status_version": 3,
  "subdomain": "sunny-bakery"
}
